{
  "$schema": "https://json-schema.org/draft/2020-12/schema",
  "$id": "https://github.com/Gnacik/glyfetti/schema/style.schema.json",
  "title": "Glyfetti style (raw level)",
  "description": "Styled bitmap font atlas definition. See docs/STYLE_REFERENCE.md.",
  "type": "object",
  "required": [
    "name",
    "font",
    "size",
    "chars",
    "fill",
    "outline"
  ],
  "properties": {
    "$schema": {
      "type": "string"
    },
    "name": {
      "type": "string",
      "description": "Style name and output file name.",
      "minLength": 1,
      "maxLength": 100,
      "pattern": "^[A-Za-z0-9][A-Za-z0-9_-]*$"
    },
    "description": {
      "type": "string"
    },
    "order": {
      "type": "integer",
      "description": "Position in the gallery."
    },
    "font": {
      "type": "string",
      "description": "TTF/OTF path, relative to the style file.",
      "minLength": 1
    },
    "font_label": {
      "type": "string",
      "description": "Human-readable font name for galleries."
    },
    "variation": {
      "oneOf": [
        {
          "type": "array",
          "items": {
            "type": "number"
          }
        },
        {
          "type": "object",
          "additionalProperties": {
            "type": "number"
          }
        }
      ],
      "description": "Variable font axes, e.g. {\"wght\": 800}."
    },
    "auto_diacritics": {
      "type": "boolean",
      "default": true,
      "description": "Compose missing Polish letters from accents in the font."
    },
    "size": {
      "type": "integer",
      "description": "Font size in the atlas (px).",
      "minimum": 8,
      "maximum": 512
    },
    "supersample": {
      "type": "integer",
      "minimum": 1,
      "maximum": 4,
      "default": 3
    },
    "chars": {
      "type": "string",
      "description": "Characters to include.",
      "minLength": 1,
      "maxLength": 10000
    },
    "atlas_width": {
      "type": "integer",
      "default": 1024,
      "minimum": 8,
      "maximum": 8192
    },
    "tracking": {
      "type": "number",
      "description": "Extra letter spacing (px); negative merges outlines.",
      "minimum": -512,
      "maximum": 512
    },
    "line_height": {
      "type": "number",
      "description": "Line height multiplier.",
      "minimum": 0.5,
      "maximum": 3
    },
    "condense": {
      "type": "number",
      "description": "Horizontal glyph scale.",
      "minimum": 0.5,
      "maximum": 1.5
    },
    "embolden": {
      "type": "number",
      "description": "Stroke thickening before effects (px).",
      "minimum": 0,
      "maximum": 20
    },
    "preview": {
      "type": "array",
      "items": {
        "type": "string",
        "maxLength": 2000,
        "pattern": "^[^\\r\\n]*$"
      },
      "minItems": 1,
      "maxItems": 20
    },
    "preview_bg": {
      "type": "string",
      "description": "#RRGGBB or 'transparent'.",
      "pattern": "^(#[0-9A-Fa-f]{6}|transparent)$"
    },
    "jitter": {
      "oneOf": [
        {
          "type": "null"
        },
        {
          "type": "object",
          "properties": {
            "rotate": {
              "type": "number",
              "description": "Max rotation (deg).",
              "minimum": 0,
              "maximum": 45
            },
            "y": {
              "type": "number",
              "description": "Max vertical offset (px).",
              "minimum": 0,
              "maximum": 100
            },
            "seed": {
              "type": "integer"
            }
          },
          "additionalProperties": false
        }
      ]
    },
    "fill": {
      "type": "object",
      "required": [
        "stops"
      ],
      "properties": {
        "stops": {
          "type": "array",
          "minItems": 1,
          "items": {
            "type": "array",
            "prefixItems": [
              {
                "type": "number",
                "minimum": 0,
                "maximum": 1
              },
              {
                "type": "string",
                "pattern": "^#[0-9A-Fa-f]{6}$"
              }
            ],
            "minItems": 2,
            "maxItems": 2
          }
        },
        "gradient_space": {
          "enum": [
            "glyph",
            "line"
          ],
          "default": "glyph"
        }
      },
      "additionalProperties": false
    },
    "outline": {
      "type": "object",
      "required": [
        "color",
        "width"
      ],
      "properties": {
        "color": {
          "type": "string",
          "pattern": "^#[0-9A-Fa-f]{6}$"
        },
        "width": {
          "type": "number",
          "description": "Outline width (px).",
          "minimum": 0,
          "maximum": 40
        }
      },
      "additionalProperties": false
    },
    "side": {
      "type": "object",
      "properties": {
        "enabled": {
          "type": "boolean",
          "default": true,
          "description": "Set false to disable the layer."
        },
        "depth": {
          "type": "number",
          "description": "3D side depth (px).",
          "minimum": 0,
          "maximum": 40
        },
        "dx": {
          "type": "number",
          "description": "Horizontal skew of the side (px).",
          "minimum": -512,
          "maximum": 512
        },
        "color_top": {
          "type": "string",
          "pattern": "^#[0-9A-Fa-f]{6}$"
        },
        "color_bottom": {
          "type": "string",
          "pattern": "^#[0-9A-Fa-f]{6}$"
        }
      },
      "allOf": [
        {
          "if": {
            "properties": {
              "enabled": {
                "const": false
              }
            },
            "required": [
              "enabled"
            ]
          },
          "then": {},
          "else": {
            "required": [
              "depth",
              "color_top",
              "color_bottom"
            ]
          }
        }
      ],
      "additionalProperties": false
    },
    "bevel": {
      "type": "object",
      "properties": {
        "enabled": {
          "type": "boolean",
          "default": true,
          "description": "Set false to disable the layer."
        },
        "size": {
          "type": "number",
          "description": "Bevel width (px).",
          "minimum": 0,
          "maximum": 40,
          "exclusiveMinimum": 0
        },
        "soften": {
          "type": "number",
          "description": "Height map smoothing (px).",
          "minimum": 0,
          "maximum": 40
        },
        "light_angle": {
          "type": "number",
          "description": "Light direction in degrees, 90 = from top."
        },
        "highlight_color": {
          "type": "string",
          "pattern": "^#[0-9A-Fa-f]{6}$"
        },
        "highlight_strength": {
          "type": "number",
          "description": "",
          "minimum": 0,
          "maximum": 1
        },
        "shadow_color": {
          "type": "string",
          "pattern": "^#[0-9A-Fa-f]{6}$"
        },
        "shadow_strength": {
          "type": "number",
          "description": "",
          "minimum": 0,
          "maximum": 1
        }
      },
      "allOf": [
        {
          "if": {
            "properties": {
              "enabled": {
                "const": false
              }
            },
            "required": [
              "enabled"
            ]
          },
          "then": {},
          "else": {
            "required": [
              "size",
              "light_angle",
              "highlight_color",
              "highlight_strength",
              "shadow_color",
              "shadow_strength"
            ]
          }
        }
      ],
      "additionalProperties": false
    },
    "gloss": {
      "type": "object",
      "properties": {
        "enabled": {
          "type": "boolean",
          "default": true,
          "description": "Set false to disable the layer."
        },
        "color": {
          "type": "string",
          "pattern": "^#[0-9A-Fa-f]{6}$"
        },
        "opacity": {
          "type": "number",
          "description": "",
          "minimum": 0,
          "maximum": 1
        },
        "inset": {
          "type": "number",
          "description": "Inset from edge (px).",
          "minimum": 0,
          "maximum": 100
        },
        "height": {
          "type": "number",
          "description": "Covered fraction from top.",
          "minimum": 0,
          "maximum": 1
        },
        "blur": {
          "type": "number",
          "description": "",
          "minimum": 0,
          "maximum": 100
        }
      },
      "allOf": [
        {
          "if": {
            "properties": {
              "enabled": {
                "const": false
              }
            },
            "required": [
              "enabled"
            ]
          },
          "then": {},
          "else": {
            "required": [
              "color",
              "opacity",
              "inset",
              "height",
              "blur"
            ]
          }
        }
      ],
      "additionalProperties": false
    },
    "shadow": {
      "type": "object",
      "properties": {
        "enabled": {
          "type": "boolean",
          "default": true,
          "description": "Set false to disable the layer."
        },
        "color": {
          "type": "string",
          "pattern": "^#[0-9A-Fa-f]{6}$"
        },
        "opacity": {
          "type": "number",
          "description": "",
          "minimum": 0,
          "maximum": 1
        },
        "dx": {
          "type": "number",
          "description": "Offset X (px).",
          "minimum": -512,
          "maximum": 512
        },
        "dy": {
          "type": "number",
          "description": "Offset Y (px).",
          "minimum": -512,
          "maximum": 512
        },
        "blur": {
          "type": "number",
          "description": "Blur (px). dx=dy=0 + large blur = glow.",
          "minimum": 0,
          "maximum": 100
        }
      },
      "allOf": [
        {
          "if": {
            "properties": {
              "enabled": {
                "const": false
              }
            },
            "required": [
              "enabled"
            ]
          },
          "then": {},
          "else": {
            "required": [
              "color",
              "opacity",
              "dx",
              "dy"
            ]
          }
        }
      ],
      "additionalProperties": false
    },
    "extrude": {
      "type": "object",
      "properties": {
        "enabled": {
          "type": "boolean",
          "default": true,
          "description": "Set false to disable the layer."
        },
        "color": {
          "type": "string",
          "pattern": "^#[0-9A-Fa-f]{6}$"
        },
        "depth": {
          "type": "number",
          "description": "Offset of the base outside the outline (px).",
          "minimum": 0,
          "maximum": 100
        },
        "opacity": {
          "type": "number",
          "description": "",
          "minimum": 0,
          "maximum": 1
        },
        "blur": {
          "type": "number",
          "description": "",
          "minimum": 0,
          "maximum": 100
        }
      },
      "allOf": [
        {
          "if": {
            "properties": {
              "enabled": {
                "const": false
              }
            },
            "required": [
              "enabled"
            ]
          },
          "then": {},
          "else": {
            "required": [
              "color",
              "depth"
            ]
          }
        }
      ],
      "additionalProperties": false
    },
    "max_atlas_size": {
      "type": "integer",
      "minimum": 8,
      "maximum": 8192,
      "default": 8192,
      "description": "Maximum atlas width and height; oversized builds fail without cropping."
    },
    "kerning": {
      "type": "boolean",
      "default": true,
      "description": "Export horizontal pair kerning and apply it to previews."
    },
    "kerning_script": {
      "type": "string",
      "pattern": "^[A-Za-z0-9 ]{4}$",
      "default": "latn",
      "description": "OpenType script for the default language kern feature; falls back to DFLT."
    },
    "atlas_packing": {
      "enum": [
        "maxrects",
        "shelf"
      ],
      "default": "maxrects",
      "description": "Atlas packing without glyph rotation. MaxRects falls back to shelf if smaller."
    }
  },
  "additionalProperties": false
}
