{
  "$schema": "../schema/style.schema.json",
  "name": "fire",
  "order": 6,
  "description": "Fiery combo text with an orange glow",
  "font": "../fonts/TitanOne-Regular.ttf",
  "font_label": "Titan One",
  "size": 90,
  "supersample": 3,
  "atlas_width": 2048,
  "tracking": -3,
  "line_height": 1.05,
  "condense": 0.78,
  "embolden": 0,
  "chars": "ABCDEFGHIJKLMNOPQRSTUVWXYZĄĆĘŁŃÓŚŹŻabcdefghijklmnopqrstuvwxyząćęłńóśźż0123456789!?.,:;%+-–×*/\\#'\"=()[]{}<>&@_~^$€…«»„”“",
  "fill": {
    "gradient_space": "glyph",
    "stops": [
      [
        0,
        "#FFF8B5"
      ],
      [
        0.4,
        "#FFC93C"
      ],
      [
        1,
        "#FF5E14"
      ]
    ]
  },
  "outline": {
    "color": "#3A0A02",
    "width": 4
  },
  "side": {
    "depth": 6,
    "dx": 1,
    "color_top": "#D23A10",
    "color_bottom": "#7E1404"
  },
  "bevel": {
    "size": 4,
    "soften": 1.0,
    "light_angle": 100,
    "highlight_color": "#FFFDE0",
    "highlight_strength": 0.5,
    "shadow_color": "#E8761E",
    "shadow_strength": 0.4
  },
  "gloss": {
    "enabled": false
  },
  "shadow": {
    "color": "#FF6A1A",
    "opacity": 0.8,
    "dx": 0,
    "dy": 0,
    "blur": 12
  },
  "extrude": {
    "enabled": false
  },
  "jitter": {
    "rotate": 4,
    "y": 3,
    "seed": 5
  },
  "preview": [
    "On Fire!",
    "x3 Combo"
  ],
  "preview_bg": "#2A1010"
}