{
  "$schema": "../schema/style.schema.json",
  "name": "magic_purple",
  "order": 7,
  "description": "Purple magic with a glow – power-ups, spells",
  "font": "../fonts/Grandstander.ttf",
  "font_label": "Grandstander",
  "size": 90,
  "supersample": 3,
  "atlas_width": 2048,
  "tracking": -3,
  "line_height": 1.05,
  "condense": 0.8,
  "embolden": 0,
  "chars": "ABCDEFGHIJKLMNOPQRSTUVWXYZĄĆĘŁŃÓŚŹŻabcdefghijklmnopqrstuvwxyząćęłńóśźż0123456789!?.,:;%+-–×*/\\#'\"=()[]{}<>&@_~^$€…«»„”“",
  "fill": {
    "gradient_space": "glyph",
    "stops": [
      [
        0,
        "#FAF0FF"
      ],
      [
        0.45,
        "#CFA6FF"
      ],
      [
        1,
        "#8C55F0"
      ]
    ]
  },
  "outline": {
    "color": "#1E0D40",
    "width": 4
  },
  "side": {
    "depth": 5,
    "dx": 1,
    "color_top": "#6234C2",
    "color_bottom": "#38197A"
  },
  "bevel": {
    "size": 4,
    "soften": 1.0,
    "light_angle": 100,
    "highlight_color": "#FFFFFF",
    "highlight_strength": 0.5,
    "shadow_color": "#9C6CF0",
    "shadow_strength": 0.35
  },
  "gloss": {
    "enabled": false
  },
  "shadow": {
    "color": "#B57BFF",
    "opacity": 0.85,
    "dx": 0,
    "dy": 0,
    "blur": 12
  },
  "extrude": {
    "enabled": false
  },
  "jitter": {
    "rotate": 2.5,
    "y": 2,
    "seed": 11
  },
  "preview": [
    "Magic Bonus",
    "Spell ready"
  ],
  "preview_bg": "#1A1030",
  "variation": {
    "wght": 900
  }
}