{
  "$schema": "../schema/style.schema.json",
  "name": "ice_blue",
  "order": 5,
  "description": "Icy blue with a glow – freeze effects",
  "font": "../fonts/TitanOne-Regular.ttf",
  "font_label": "Titan One",
  "size": 90,
  "supersample": 3,
  "atlas_width": 2048,
  "tracking": -3,
  "line_height": 1.05,
  "condense": 0.78,
  "embolden": 0,
  "chars": "ABCDEFGHIJKLMNOPQRSTUVWXYZĄĆĘŁŃÓŚŹŻabcdefghijklmnopqrstuvwxyząćęłńóśźż0123456789!?.,:;%+-–×*/\\#'\"=()[]{}<>&@_~^$€…«»„”“",
  "fill": {
    "gradient_space": "glyph",
    "stops": [
      [
        0,
        "#FFFFFF"
      ],
      [
        0.4,
        "#C8F0FF"
      ],
      [
        1,
        "#62C2F2"
      ]
    ]
  },
  "outline": {
    "color": "#0E2F55",
    "width": 4
  },
  "side": {
    "depth": 6,
    "dx": 1,
    "color_top": "#2E8FD2",
    "color_bottom": "#174F88"
  },
  "bevel": {
    "size": 4,
    "soften": 1.0,
    "light_angle": 100,
    "highlight_color": "#FFFFFF",
    "highlight_strength": 0.6,
    "shadow_color": "#3FA4DE",
    "shadow_strength": 0.35
  },
  "gloss": {
    "color": "#FFFFFF",
    "opacity": 0.5,
    "inset": 5,
    "height": 0.35,
    "blur": 3
  },
  "shadow": {
    "color": "#9BE3FF",
    "opacity": 0.6,
    "dx": 0,
    "dy": 0,
    "blur": 10
  },
  "extrude": {
    "enabled": false
  },
  "jitter": {
    "rotate": 2.5,
    "y": 2,
    "seed": 11
  },
  "preview": [
    "Frozen!",
    "x2 Freeze"
  ],
  "preview_bg": "#1B3A5C"
}